{
  "contract": "fluxrt-h3-time-map",
  "version": 1,
  "motor_id": "DengFOC-M0-AS5600-on-G431-IHM16M1",
  "reference_firmware_sha256": "4663585A44D43D51C9F5277A2C0BBB4AE258A1B1EA10201885AF4DCC8E6535CF",
  "truth_firmware_sha256": "A3B7D85EE5C551C786CDF3D54FBC253F24888BA214F54D9A5F6BB1EA226AD702",
  "pole_pairs": 7,
  "mechanical_direction": 1,
  "electrical_offset_rad": -0.474181205,
  "reference_tick_hz": 12000,
  "truth_tick_hz": 1000000,
  "requirements": {
    "minimum_anchor_count": 16,
    "maximum_anchor_residual_ticks": 0.05,
    "maximum_clock_drift_ppm": 100.0,
    "maximum_truth_gap_ticks": 10000,
    "maximum_truth_missing_samples": 9
  },
  "anchors_csv_path": "profiles/identification/sessions/h3-dynamic-20261005-session2026100509-partial-diagnostic-v2/paired-anchors.csv",
  "anchors_csv_sha256": "E145353570D70D5F2C7D706D7B5513DEC5EC95EDB37DF27199DE734F9F447E2B",
  "truth_csv_path": "profiles/identification/sessions/h3-dynamic-20261005-session2026100509-partial-diagnostic-v2/valid-truth.csv",
  "truth_csv_sha256": "C7DDF763BF66984B2E22E22A22A57FC3AF2CB83ADA382DA8D9FF8E7F5D562681",
  "queries_csv_path": "profiles/identification/sessions/h3-dynamic-20261005-session2026100509-partial-diagnostic-v2/bracketed-queries.csv",
  "queries_csv_sha256": "A2FF6B8058B4921B16B22637B4324CBEF9F6A00389B5ED5D91E09089978504ED",
  "parameter_approval": "not-granted",
  "target_capability_approval": "not-granted"
}
